|id|Название|Регион:|Населённый пункт:|Форма собственности:|Адрес:|Лицензия: №|specialization
314|2190|Филиал государственного бюджетного образовательного учреждения высшего образования «Ставропольский государственный педагогический институт» в г. Ессентуки|Ставропольский край|г. Ессентуки|Негосударственный филиал|357635, Российская Федерация, Ставропольский край, г. Ессентуки, ул. Долина Роз, д. 7|1695 от 12.10.2015 (Бессрочная)|['440201', '440202', '440301', '440302', '440303', '440305', '490201', '490202']
315|420|Частное образовательное учреждение высшего образования «Липецкий эколого-гуманитарный институт»|Липецкая область|г. Липецк|Негосударственный головной ВУЗ|398050, г. Липецк, ул. Нижняя Логовая, д. 2|2727 от 20.03.2018 (Бессрочная)|['380301', '380301', '380302', '380302', '380304', '380304', '380305', '380305', '380401', '380401', '450302', '450302']
316|1923|филиал федерального государственного автономного образовательного учреждения высшего образования «Российский университет дружбы народов» в г. Белгороде|Белгородская область| г. Белгород|Государственный филиал|Народный бульвар, д. 21, г. Белгород, Белгородская область, 308001|1204 от 23.12.2014 (Бессрочная)|['030501', '030501', '080103', '080103']
317|9496|государственное образовательное учреждение среднего профессионального образования «Вятский автомобильно-промышленный колледж»|Кировская область|г. Кирово-Чепецк|Государственный головной ВУЗ|ул. Фестивальная, д. 14, корп. 2, г. Кирово-Чепецк, Кировская область, 613043|2282 от 08.12.2011 (Бессрочная)|['030503', '080110', '080402', '080501', '080501']
318|530|Частное образовательное учреждение высшего образования Институт программных систем «УГП имени А.К. Айламазяна»|Ярославская область|г. Переславль-Залесский|Негосударственный головной ВУЗ|152020, Ярославская область, г. Переславль-Залесский, ул. Советская, д. 2|1863 от 30.12.2015 (Бессрочная)|['010501', '080801', '230201']
319|11936|федеральное государственное бюджетное образовательное учреждение среднего профессионального образования «Хабаровский торгово-экономический техникум»|Хабаровский край|г. Хабаровск|Государственный головной ВУЗ|ул. Карла Маркса, д. 136, г. Хабаровск, Хабаровский край, 680031|2259 от 08.12.2011 (Бессрочная)|['030503', '030504', '080110', '080402', '150413', '260202', '260502', '261301']
320|1712|федеральное государственное бюджетное образовательное учреждение высшего образования «Саратовский государственный аграрный университет имени Н.И. Вавилова»|Саратовская область|г. Саратов|Государственный головной ВУЗ|410012, Саратовская область, г. Саратов, Театральная площадь, 1|1563 от 20.07.2015 (Бессрочная)|['050306', '050306', '050306', '050406', '050406', '050406', '050601', '050601', '050601', '060303', '060601', '060601', '060601', '080301', '080301', '080301', '080401', '080401', '080401', '130301', '130301', '130301', '130401', '130401', '130401', '150213', '150302', '150302', '190203', '190203', '190203', '190207', '190207', '190207', '190208', '190208', '190208', '190210', '190210', '190210', '190301', '190301', '190301', '190302', '190302', '190302', '190303', '190303', '190303', '190304', '190304', '190304', '190401', '190401', '190401', '190402', '190403', '190403', '190403', '190404', '190404', '190404', '190601', '190601', '190601', '200301', '200301', '200301', '200302', '200302', '200302', '200402', '200402', '200402', '200501', '200501', '200501', '210302', '210302', '210302', '210402', '210402', '210402', '230203', '230207', '230302', '230302', '230302', '230402', '230402', '230402', '230501', '230501', '230501', '270302', '270302', '270302', '270401', '270401', '270402', '350205', '350207', '350208', '350216', '350301', '350301', '350301', '350303', '350303', '350304', '350304', '350304', '350306', '350306', '350306', '350307', '350308', '350308', '350308', '350310', '350310', '350310', '350401', '350401', '350401', '350404', '350404', '350404', '350406', '350406', '350406', '350407', '350407', '350407', '350409', '350409', '350409', '350601', '350601', '350601', '350602', '350602', '350602', '350604', '350604', '350604', '360201', '360302', '360302', '360302', '360402', '360402', '360402', '360501', '360501', '360501', '360601', '360601', '360601', '380201', '380201', '380201', '380301', '380301', '380301', '380302', '380302', '380302', '380306', '380306', '380307', '380307', '380401', '380401', '380401', '380402', '380402', '380402', '380601', '380601', '380601', '430215', '440601', '440601', '460601', '460601', '460601']
321|5997|Автономная некоммерческая организация высшего образования «Национальный открытый институт г.Санкт-Петербург»|г. Санкт-Петербург||Негосударственный головной ВУЗ||2618 от 28.07.2017 (Бессрочная)|['090205', '090303', '210302', '210303', '370301', '380201', '380203', '380301', '380302', '380304', '380401', '380402', '380404', '390202', '390302']
322|9759|Чебоксарский филиал федерального государственного бюджетного образовательного учреждения высшего профессионального образования «Московский государственный гуманитарный университет имени М.А. Шолохова»|Чувашская Республика - Чувашия| г. Чебоксары|Государственный филиал|ул. Шумилова, д. 8, г. Чебоксары, Чувашская Республика - Чувашия, 428027|2452 от 02.02.2012 (Бессрочная)|['050303', '050706', '050715', '080504']
323|9239|Федеральное государственное образовательное учреждение среднего профессионального образования «Кинешемский технологический техникум-интернат» Министерства здравоохранения и социального развития Российской Федерации (ФГОУ СПО «КТТИ» Минздравсоцразвития Рос|Ивановская область|г. Кинешма|Негосударственный головной ВУЗ|155400, Ивановская область, г. Кинешма, ул. Юрьевецкая, д. 46|0223 от 11.10.2010 (Бессрочная)|['230105', '260905']
324|5456|филиал федерального государственного бюджетного образовательного учреждения высшего образования «Самарский государственный университет путей сообщения» в г. Ижевске|Удмуртская Республика|г. Ижевск|Негосударственный филиал|426049, Удмуртская Республика, г. Ижевск, ул. Локомотивная, д. 29|2342 от 18.08.2016 (Бессрочная)|['080205', '080210', '090202', '230201', '270203']
325|11222|Федеральное государственное бюджетное учреждение науки Центр фотохимии Российской академии наук|г. Москва|г. Москва|Негосударственный головной ВУЗ|119421, г. Москва, ул. Новаторов, д. 7А корп. 1|2685 от 05.04.2012 (Бессрочная)|['040601']
326|10131|Федеральное государственное бюджетное научное учреждение «Научно-исследовательский институт медицинской приматологии»|Краснодарский край| г. Сочи|Негосударственный головной ВУЗ|354376, Краснодарский край, г. Сочи, Адлерский район, с.Весёлое, ул. Мира, д. 177|2057 от 01.04.2016 (Бессрочная)|['060601']
327|10100|Филиал федеральное государственное бюджетное образовательное учреждение высшего профессионального образования «Всероссийский заочный финансово-экономический институт» в г. Липецке|Липецкая область||Государственный филиал|Интернациональная, 12б, Липецк, Липецкая область, 398000|2102 от 24.10.2011 (Бессрочная)|['080104', '080105', '080109', '080504', '080507']
328|11656|Федеральное государственное бюджетное учреждение науки Федеральный исследовательский центр «Кольский научный центр Российской академии наук»|Мурманская область| г. Апатиты|Государственный головной ВУЗ|184209, Мурманская область, г. Апатиты, ул. Ферсмана, д. 14|2721 от 22.02.2018 (Бессрочная)|['050601', '060601', '130601', '180601', '210601', '220601', '380601', '460601']
329|12115|Федеральное государственное бюджетное учреждение науки Институт геологии рудных месторождений, петрографии, минералогии и геохимии Российской академии наук|г. Москва|г. Москва|Негосударственный головной ВУЗ|Российская Федерация, 119017, г. Москва, Старомонетный переулок, дом 35|0555 от 05.03.2013 (Бессрочная)|['050601']
330|958|федеральное государственное бюджетное образовательное учреждение высшего образования «Ярославский государственный технический университет»|Ярославская область|г. Ярославль|Государственный головной ВУЗ|150023, Ярославская область, город Ярославль, Московский проспект, дом 88|2316 от 04.08.2016 (Бессрочная)|['040301', '040401', '040501', '040601', '050601', '070301', '070401', '080301', '080401', '090302', '090304', '090402', '130303', '130403', '130601', '150301', '150302', '150305', '150402', '150405', '150601', '180301', '180302', '180401', '180402', '180601', '200302', '200402', '220301', '220401', '230302', '230303', '230402', '230403', '230501', '270301', '270302', '270304', '270401', '270402', '270404', '270601', '380301', '380302', '380401', '380402', '440304', '440404']
331|191|бюджетное учреждение высшего образования Ханты-Мансийского автономного округа – Югры «Сургутский государственный университет»|Ханты-Мансийский автономный округ - Югра|г. Сургут|Негосударственный головной ВУЗ|Российская Федерация, 628412, Ханты-Мансийский автономный округ - Югра, город Сургут, проспект Ленина, дом 1|2812 от 20.03.2019 (Бессрочная)|['010302', '010302', '010402', '010402', '010601', '010601', '030302', '030302', '030402', '030402', '030601', '030601', '040301', '040301', '040401', '040501', '040501', '040601', '040601', '050306', '050306', '050406', '050406', '050601', '060301', '060301', '060401', '060401', '060601', '060601', '080301', '080301', '080401', '080401', '090301', '090301', '090302', '090302', '090304', '090304', '090401', '090401', '090402', '090402', '090601', '090601', '100601', '110302', '110302', '110402', '110402', '130302', '130302', '130402', '130402', '200301', '200301', '200401', '200501', '200501', '270304', '270304', '270404', '270404', '270601', '300601', '300601', '310201', '310201', '310202', '310202', '310203', '310203', '310206', '310501', '310501', '310502', '310502', '310601', '310601', '310801', '310801', '310802', '310802', '310804', '310804', '310805', '310805', '310807', '310807', '310809', '310809', '310811', '310811', '310817', '310817', '310818', '310818', '310819', '310819', '310821', '310821', '310826', '310826', '310831', '310831', '310832', '310832', '310835', '310835', '310836', '310836', '310837', '310837', '310842', '310842', '310848', '310848', '310849', '310849', '310850', '310850', '310851', '310851', '310853', '310853', '310854', '310854', '310857', '310857', '310858', '310858', '310859', '310859', '310863', '310863', '310866', '310866', '310867', '310867', '310871', '310871', '320601', '320601', '340101', '340201', '340201', '340202', '340202', '370401', '370401', '370501', '370501', '370502', '370502', '370601', '380301', '380301', '380302', '380302', '380303', '380303', '380304', '380304', '380401', '380401', '380402', '380402', '380403', '380403', '380404', '380404', '380408', '380408', '380501', '380601', '380601', '400301', '400301', '400401', '400601', '400601', '410304', '410304', '410404', '410404', '420301', '420301', '440301', '440301', '440304', '440305', '440401', '440401', '440601', '440601', '450302', '450302', '450402', '450402', '450601', '450601', '460301', '460301', '460401', '460401', '460601', '460601', '470601', '470601', '490301', '490301', '490302', '490302', '490303', '490303', '490401', '490401', '490402', '490402', '490403', '490403', '490601', '490601', '510302', '510302', '510304', '510304']
332|1447|Институт технологий и бизнеса (филиал) федерального государственного бюджетного образовательного учреждения высшего образования «Московский государственный университет технологий и управления имени К.Г. Разумовского (Первый казачий университет)»|Московская область|г. Орехово-Зуево|Негосударственный филиал|142601, Московская область, г. Орехово-Зуево, ул. Шулайкиной, д. 2|1125 от 10.11.2014 (Бессрочная)|['080100', '080100', '080109', '080109', '080109', '080200', '080200', '080502', '080502', '150406', '150406', '150406', '150406', '151000', '151000', '260704', '260704', '260704', '260704', '260902', '260902', '261100', '262000', '262000', '262200', '262200']
333|421|Автономная некоммерческая организация высшего образования «Международная академия бизнеса и управления»|г. Москва| г. Москва|Негосударственный головной ВУЗ|129594, г. Москва, 5-й проезд Марьиной рощи, д. 15А|1500 от 19.06.2015 (Бессрочная)|['380302', '380402', '380502', '400301', '410305', '450501', '540301']
334|483|Негосударственное образовательное учреждение высшего профессионального образования «Рязанский институт управления и права»|Рязанская область|г. Рязань|Негосударственный головной ВУЗ|390035, г. Рязань, ул. Полетаева, д. 25|0776 от 08.07.2013 (Бессрочная)|['030500', '030501', '080100', '080105', '080109']
335|1165|Выборгский филиал федерального государственного бюджетного образовательного учреждения высшего образования «Российская академия народного хозяйства и государственной службы при Президенте Российской Федерации»|Ленинградская область|г. Выборг|Негосударственный филиал|188800, Ленинградская область, г. Выборг, Ленинградский просп., д. 11|2787 от 07.12.2018 (Бессрочная)|['380302', '380304', '380502']
336|10597|Псковский филиал федерального государственного бюджетного образовательного учреждения высшего профессионального образования «Санкт-Петербургский государственный университет сервиса и экономики»|Псковская область| г. Псков|Государственный филиал|Ленинградское шоссе, д. 24, г. Псков, Псковская область, 180000|2862 от 28.05.2012 (Бессрочная)|['080500', '080507', '100100', '100101', '100103']
337|1166|Дальневосточный институт управления - филиал федерального государственного бюджетного образовательного учреждения высшего образования «Российская академия народного хозяйства и государственной службы при Президенте Российской Федерации»|Хабаровский край|г. Хабаровск|Негосударственный филиал|680000, г. Хабаровск, ул. Муравьева-Амурского, д. 33|2787 от 07.12.2018 (Бессрочная)|['380207', '380301', '380302', '380304', '380401', '380402', '380403', '380404', '380408', '380501', '380601', '390301', '390302', '390601', '400301', '400401', '400501', '460601']
338|5660|Автономная некоммерческая организация высшего образования «Сибирский институт бизнеса, управления и психологии»|Красноярский край| г. Красноярск|Негосударственный головной ВУЗ|660037, Россия, Красноярский край, г. Красноярск, ул. Московская, 7 «А»|2034 от 28.03.2016 (Бессрочная)|['370301', '380201', '380301', '380302', '430210']
339|8108|Федеральное государственное бюджетное учреждение науки Институт востоковедения Российской академии наук|г. Москва|г. Москва|Негосударственный головной ВУЗ|Российская Федерация, 107031, г. Москва, ул. Рождественка, д. 12|0186 от 19.07.2012 (Бессрочная)|['380601', '410601', '450601', '460601']
340|9226|Автономная некоммерческая организация высшего образования «Гуманитарный университет»|Свердловская область| г. Екатеринбург|Негосударственный головной ВУЗ|620041, г. Екатеринбург, ул. Железнодорожников, д. 3|2114 от 26.04.2016 (Бессрочная)|['090303', '290305', '370301', '370401', '370601', '380301', '380302', '380303', '380401', '380601', '390601', '400301', '400401', '400601', '410601']
341|487|Частное образовательное учреждение высшего образования «Ставропольский университет»|Ставропольский край|г. Ставрополь|Негосударственный головной ВУЗ|355035, Ставропольский край, г. Ставрополь, проспект Кулакова, д. 8|1523 от 24.06.2015 (Бессрочная)|['080201', '090203', '380201', '380207', '380601', '400201', '400601', '430210', '540201']
342|238|Западно-Уральский филиал негосударственного образовательного учреждения Московская международная высшая школа бизнеса «МИРБИС» (Институт)»|Пермский край| г. Пермь|Негосударственный филиал|ул. Луначарского, д. 11, г. Пермь, Пермский край, 614045|1516 от 23.06.2011 (Бессрочная)|['080105', '080502', '080507']
343|8993|Государственное казенное учреждение Республики Мордовия «Научно-исследовательский институт гуманитарных наук при Правительстве Республики Мордовия»|Республика Мордовия|г. Саранск|Негосударственный головной ВУЗ|430005, Российская Федерация, Республика Мордовия, г. Саранск, ул. Льва Толстого, д. 3|2192 от 28.11.2011 (Бессрочная)|['380601', '410601', '450601', '460601', '510601']
344|942|федеральное государственное бюджетное образовательное учреждение высшего образования «Уральский институт Государственной противопожарной службы Министерства Российской Федерации по делам гражданской обороны, чрезвычайным ситуациям и ликвидации последствий стихийных бедствий»|Свердловская область|г. Екатеринбург|Негосударственный головной ВУЗ|620062, г. Екатеринбург, ул. Мира, д. 22|1842 от 24.12.2015 (Бессрочная)|['200204', '200301', '200401', '200501', '200601', '200701', '380304', '380404', '400503']
345|2282|федеральное государственное бюджетное образовательное учреждение высшего образования «Российский государственный университет туризма и сервиса»|Московская область|пос. Черкизово|Государственный головной ВУЗ|141221, Московская область, Пушкинский район, дачный поселок Черкизово, ул. Главная, д. 99|1861 от 30.12.2015 (Бессрочная)|['090204', '110201', '110202', '150302', '150402', '150601', '380207', '380301', '380302', '380304', '380402', '380404', '380601', '390601', '400201', '400301', '430201', '430210', '430211', '430301', '430302', '430303', '430401', '430402', '430403', '540201', '540301']
346|464|Частное учреждение образовательная организация высшего образования «Омская гуманитарная академия»|Омская область|г. Омск|Негосударственный головной ВУЗ|Россия, 644105, г. Омск, ул. 4-я Челюскинцев, 2 «А»|1764 от 12.11.2015 (Бессрочная)|['090303', '370301', '370401', '370601', '380301', '380302', '380303', '380304', '380306', '380401', '380402', '380404', '380601', '390302', '410304', '410601', '420301', '420302', '420402', '440301', '440302', '440303', '440305', '440401', '440402', '440601', '450301', '450601', '470601']
