|id|Название|Регион:|Населённый пункт:|Форма собственности:|Адрес:|Лицензия: №|specialization
209|1157|Астраханский филиал федерального государственного бюджетного образовательного учреждения высшего образования «Российская академия народного хозяйства и государственной службы при Президенте Российской Федерации»|Астраханская область|г. Астрахань|Негосударственный филиал|414024, г. Астрахань, ул. Б. Хмельницкого, д.33, корпус 1|2787 от 07.12.2018 (Бессрочная)|['380301', '380302', '380304']
210|2540|федеральное государственное бюджетное образовательное учреждение высшего образования «Тверской государственный университет»|Тверская область|г. Тверь|Государственный головной ВУЗ|170100,область Тверская , город Тверь, улица Желябова, 33|1407 от 24.04.2015 (Бессрочная)|['010301', '010302', '010402', '010601', '020301', '020302', '020303', '020401', '020402', '030302', '030303', '030402', '030403', '030601', '040301', '040401', '040501', '040601', '050302', '050306', '050402', '050406', '050601', '060301', '060401', '060601', '090303', '090403', '090601', '100501', '190302', '270305', '350301', '350305', '370301', '370401', '370501', '370601', '380301', '380302', '380303', '380304', '380305', '380307', '380401', '380402', '380408', '380502', '380601', '390301', '390302', '390303', '390401', '390402', '390601', '400301', '400401', '400601', '410301', '410304', '410305', '410404', '410405', '410601', '420301', '420302', '420303', '420402', '420403', '420404', '420601', '430301', '430302', '440301', '440302', '440303', '440305', '440401', '440402', '440601', '450301', '450302', '450303', '450401', '450402', '450403', '450601', '460301', '460302', '460401', '460601', '470601', '480301', '490301', '490401', '510306', '510401', '520305', '520504']
211|399|Аккредитованное частное образовательное учреждение высшего образования «Институт Управления, Бизнеса и Права» (г. Пятигорск)|Ставропольский край|г. Пятигорск|Негосударственный головной ВУЗ|357500, Ставропольский край, г. Пятигорск, пер. Зеленый, д. 1|2279 от 21.07.2016 (Бессрочная)|['380301', '380501', '380502', '400301', '400502']
212|769|федеральное государственное бюджетное образовательное учреждение высшего образования «Башкирский государственный аграрный университет»|Республика Башкортостан|г. Уфа|Государственный головной ВУЗ|450001, Республика Башкортостан, г. Уфа, ул. 50-летия Октября, д. 34|1700 от 14.10.2015 (Бессрочная)|['060601', '060601', '080301', '080301', '080401', '130301', '130301', '130401', '190302', '190302', '190303', '190303', '190304', '190304', '190402', '190402', '190403', '190403', '190404', '190404', '200302', '200302', '200402', '200402', '210302', '210302', '210303', '210303', '210402', '230302', '230302', '230303', '230303', '230403', '230403', '350301', '350301', '350303', '350303', '350304', '350304', '350306', '350306', '350307', '350307', '350310', '350310', '350401', '350401', '350403', '350403', '350404', '350404', '350406', '350406', '350601', '350601', '350602', '350602', '350604', '350604', '360302', '360302', '360402', '360402', '360501', '360501', '360601', '360601', '380301', '380301', '380302', '380302', '380304', '380304', '380305', '380305', '380401', '390601']
213|9033|Федеральное государственное бюджетное научное учреждение «Аграрный научный центр «Донской»|Ростовская область|г. Зерноград|Государственный головной ВУЗ|347740, Ростовская область, Зерноградский район, г. Зерноград, Научный городок, д. 3|2615 от 17.07.2017 (Бессрочная)|['350601', '350604']
214|10917|Негосударственное образовательное учреждение высшего профессионального образования «Московский институт рекламы, туризма, шоу-бизнеса»|г. Москва| г. Москва|Негосударственный головной ВУЗ|ул. Малая Семеновская, д. 11/2, стр. 7, г. Москва, 107023|1140 от 07.04.2011 (Бессрочная)|['032401', '032401', '080507', '100103', '100103']
215|2523|Образовательное учреждение высшего образования «Южно-Уральский технологический университет»|Челябинская область|г. Челябинск|Негосударственный головной ВУЗ|454052, г. Челябинск, ул. Комаровского, д. 9а|2872 от 03.12.2019 (Бессрочная)|['070301', '070303', '080301', '090302', '130302', '210302', '230301', '380301', '380302', '380304', '380402', '380404', '380408', '380501', '380502', '400301', '450302', '540301']
216|500|Частное образовательное учреждение высшего образования «Сочинский институт экономики и информационных технологий»|Краснодарский край|г. Сочи|Негосударственный головной ВУЗ|354068, г. Сочи, пер. Строительный, д. 10|1899 от 25.01.2016 (Бессрочная)|['090201', '090205', '090301', '090303', '380201', '380302', '380304']
217|2315|Институт сферы обслуживания и предпринимательства (филиал) федерального государственного бюджетного образовательного учреждения высшего образования «Донской государственный технический университет» в г. Шахты Ростовской области|Ростовская область|г. Шахты|Негосударственный филиал|346500, Ростовская область, г. Шахты, ул. Шевченко, д. 147|2245 от 27.06.2016 (Бессрочная)|['080301', '090203', '090302', '090303', '090402', '090601', '110301', '110302', '110401', '110501', '110601', '130302', '130402', '150302', '150402', '150601', '200301', '200401', '230203', '230301', '230303', '230401', '230403', '230601', '270301', '270401', '270405', '290301', '290305', '290401', '290405', '290601', '370301', '370401', '380103', '380201', '380202', '380301', '380302', '380303', '380306', '380307', '390302', '390402', '390601', '400301', '400401', '420301', '430211', '430301', '430302', '430303', '430401', '430402', '430403', '470601', '540301', '540401']
218|6866|Калининградский филиал федерального государственного бюджетного образовательного учреждения высшего профессионального образования «Санкт-Петербургский государственный университет сервиса и экономики»|Калининградская область| г. Калининград|Государственный филиал|ул. Генерал-лейтенанта Озерова, д. 19, г. Калининград, Калининградская область, 236022|2862 от 28.05.2012 (Бессрочная)|['080100', '080500', '080502', '100100', '100101', '100103']
219|11897|Федеральное государственное бюджетное учреждение науки Институт русской литературы (Пушкинский Дом) Российской академии наук|г. Санкт-Петербург||Негосударственный головной ВУЗ|199034, Санкт-Петербург, набережная Макарова, дом 4|2621 от 21.03.2012 (Бессрочная)|['450601']
220|10936|федеральное государственное бюджетное учреждение «Национальный медицинский исследовательский центр имени академика Е.Н. Мешалкина» Министерства здравоохранения Российской Федерации|Новосибирская область|г. Новосибирск|Государственный головной ВУЗ|630055, Российская Федерация, г. Новосибирск, ул. Речкуновская, 15|2627 от 31.08.2017 (Бессрочная)|['310601']
221|2078|Саяно-Шушенский филиал федерального государственного автономного образовательного учреждения высшего образования «Сибирский федеральный университет»|Республика Хакасия|г. Саяногорск|Государственный филиал|655619, Республика Хакасия, г. Саяногорск, пгт. Черемушки, д. 46 а/я 39|2251 от 04.07.2016 (Бессрочная)|['080301', '080401', '090302', '130302', '130402', '150302']
222|834|федеральное государственное бюджетное образовательное учреждение высшего образования «Красноярский государственный художественный институт»|Красноярский край|г. Красноярск|Негосударственный головной ВУЗ|660017, г. Красноярск, пр. Мира, д. 98|1205 от 24.12.2014 (Бессрочная)|['070601', '070603', '070801', '070901', '070902', '070903', '071001', '071002', '071003', '071500', '072500', '072600', '510302', '540301', '540302', '540502', '540503', '540504']
223|2778|Волховский филиал федерального государственного бюджетного образовательного учреждения высшего образования «Российский государственный педагогический университет им. А. И. Герцена»|Ленинградская область|г. Волхов|Негосударственный филиал|187403, Ленинградская область, г. Волхов, ул. Октябрьская набережная, д. 1а|2235 от 27.06.2016 (Бессрочная)|['440301']
224|53|Автономная некоммерческая организация высшего образования «Университет при Межпарламентской Ассамблее ЕврАзЭС»|г. Санкт-Петербург| г. Санкт-Петербург|Негосударственный головной ВУЗ|194044, г. Санкт-Петербург, ул. Смолячкова, д. 14, корп. 1, литер «Б»|2641 от 21.09.2017 (Бессрочная)|['370301', '370302', '380301', '380302', '380305', '380306', '380502', '400301', '400401', '400601', '420301', '430301', '430302', '540301', '540302']
225|9130|Филиал Федерального государственного образовательного учреждения среднего профессионального образования «Санкт-Петербургский промышленно-экономический колледж» в г. Кизляре Республики Дагестан|Республика Дагестан|г. Кизляр|Государственный филиал|ул. Ленина, д. 14, г. Кизляр, Республика Дагестан, 368800|1721 от 21.06.2011 (Бессрочная)|['030504', '080106', '080504', '190604', '230105']
226|11841|федеральное государственное бюджетное образовательное учреждение среднего профессионального образования «Воронежский авиационный техникум имени В.П. Чкалова»|Воронежская область| г. Воронеж|Государственный головной ВУЗ|ул. Ленинградская, д. 33, г. Воронеж, Воронежская область, 394004|2534 от 05.03.2012 (Бессрочная)|['080110', '080114', '080504', '151001', '160203', '210311', '220301', '230106']
227|12797|Дальневосточный юридический институт (филиал) федерального государственного казенного образовательного учреждения высшего образования «Университет прокуратуры Российской Федерации»|Приморский край||Государственный филиал||2731 от 09.04.2018 (Бессрочная)|['400504']
228|197|федеральное государственное бюджетное образовательное учреждение высшего образования «Южно-Уральский государственный медицинский университет» Министерства здравоохранения Российской Федерации|Челябинская область|г. Челябинск|Государственный головной ВУЗ|454092, Российская Федерация, Челябинская область, г. Челябинск, ул. Воровского, 64|2439 от 19.10.2016 (Бессрочная)|['300601', '310201', '310202', '310203', '310501', '310502', '310503', '310601', '310801', '310802', '310805', '310807', '310808', '310809', '310810', '310811', '310813', '310816', '310817', '310818', '310819', '310820', '310828', '310832', '310835', '310836', '310837', '310838', '310839', '310842', '310846', '310849', '310851', '310853', '310854', '310856', '310857', '310858', '310859', '310860', '310862', '310863', '310866', '310867', '310868', '310869', '310871', '310873', '310874', '310875', '310876', '320501', '320601', '320807', '320812', '330201', '330501', '330601', '340201', '370501', '390302']
229|321|Негосударственное образовательное учреждение высшего образования «Российская экономическая школа» (институт)|г. Москва|г. Москва|Негосударственный головной ВУЗ|Российская Федерация, 121353, г. Москва, Сколковское шоссе, д. 45|2736 от 23.04.2018 (Бессрочная)|['380401']
230|12764|Автономная некоммерческая организация высшего образования «Высшая школа сценических искусств»|г. Москва||Негосударственный головной ВУЗ||2924 от 04.09.2020 (Бессрочная)|['520501', '520502']
231|850|федеральное государственное бюджетное образовательное учреждение высшего образования «Московский государственный академический художественный институт имени В.И. Сурикова при Российской академии художеств»|г. Москва|г. Москва|Негосударственный головной ВУЗ|109004, г. Москва, Товарищеский пер., д. 30|2084 от 15.04.2016 (Бессрочная)|['070301', '500304', '500404', '500601', '540502', '540503', '540504']
232|5603|Архангельский филиал федерального государственного бюджетного образовательного учреждения высшего образования «Российский экономический университет имени Г.В. Плеханова»|Архангельская область| г. Архангельск|Негосударственный филиал|163000, Архангельская область, г. Архангельск, ул. Садовая, д. 42|1789 от 30.11.2015 (Бессрочная)|['090203']
233|11821|Акционерное общество «Центральный научно-исследовательский институт экономики, информатики и систем управления»|г. Москва| г. Москва|Негосударственный головной ВУЗ|Российская Федерация, 123104, г. Москва, ул. Малая Бронная, д. 2/7, стр. 1|1287 от 18.02.2015 (Бессрочная)|['020601', '090601', '380601']
234|2743|филиал федерального государственного бюджетного образовательного учреждения высшего образования «Алтайский государственный университет» в г. Славгороде|Алтайский край|г. Славгород|Негосударственный филиал|658828, Алтайский край, г. Славгород, ул. Розы Люксембург, д. 75|2296 от 29.07.2016 (Бессрочная)|['090303', '430302']
235|5629|Институт агроинженерии федерального государственного бюджетного образовательного учреждения высшего образования «Южно-Уральский государственный аграрный университет»|Челябинская область| г. Челябинск|Государственный филиал|454080, Челябинская область, г. Челябинск, проспект Ленина, д. 75|1852 от 30.12.2015 (Бессрочная)|['130302', '190302', '200601', '230302', '230303', '230501', '350306', '350403', '350404', '350406', '350604']
236|1414|филиал образовательного частного учреждения высшего образования «Институт международного права и экономики имени А.С. Грибоедова» в г. Нижневартовске|Ханты-Мансийский автономный округ - Югра|г. Нижневартовск|Негосударственный филиал|628605, Ханты-Мансийский автономный округ, г. Нижневартовск, ул. Омская, д. 66а|2139 от 17.05.2016 (Бессрочная)|['021100', '021100', '030500', '030500', '030500', '030501', '030501', '030900', '060400', '060400', '061100', '061100', '080100', '080100', '080100', '080105', '080105', '080105', '080105', '080500', '080507', '080507', '521400', '521400', '521500', '521500']
237|781|федеральное государственное бюджетное образовательное учреждение высшего образования «Вологодский государственный университет»|Вологодская область|г. Вологда|Государственный головной ВУЗ|160000, г. Вологда, ул. Ленина, д. 15|1689 от 12.10.2015 (Бессрочная)|['010302', '010402', '020301', '020601', '040301', '050302', '050306', '050406', '060301', '060401', '060601', '070301', '070401', '070402', '080301', '080401', '080501', '080502', '080601', '090204', '090207', '090301', '090302', '090303', '090304', '090401', '090402', '090404', '090601', '120304', '130301', '130302', '130401', '130402', '130601', '150201', '150208', '150212', '150301', '150302', '150305', '150306', '150401', '150404', '150405', '200301', '200302', '210302', '230203', '230303', '230501', '270304', '270305', '270405', '380201', '380204', '380301', '380302', '380304', '380401', '380402', '380404', '380501', '380601', '390301', '390302', '390402', '400201', '400203', '400301', '410306', '420302', '430301', '430302', '430303', '440301', '440302', '440305', '440401', '440601', '450302', '460601', '470601', '490201', '490302', '510301', '510401', '540304']
238|6787|федеральное государственное бюджетное учреждение «Национальный медицинский исследовательский центр травматологии и ортопедии имени Р.Р. Вредена» Министерства здравоохранения Российской Федерации|г. Санкт-Петербург|г. Санкт-Петербург|Государственный головной ВУЗ|195427, Российская Федерация, г. Санкт-Петербург, улица Академика Байкова, дом. 8|2909 от 24.07.2020 (Бессрочная)|['310601', '310866']
239|7607|федеральное государственное бюджетное учреждение «Всероссийский центр глазной и пластической хирургии» Министерства здравоохранения Российской Федерации|Республика Башкортостан| г. Уфа|Негосударственный головной ВУЗ|450075, Российская Федерация, Республика Башкортостан, г. Уфа, ул. Р. Зорге, 67/1|1003 от 13.05.2014 (Бессрочная)|['310601', '310859']
240|7595|Петровский филиал федерального государственного бюджетного образовательного учреждения высшего профессионального образования «Саратовский государственный социально-экономический университет»|Саратовская область| г. Петровск|Государственный филиал|ул. 25 лет Октября, д. 164-а, литер «А», г. Петровск, Саратовская область, 412540|1536 от 05.07.2011 (Бессрочная)|['080109', '080109', '080502', '080502']
241|2373|федеральное государственное бюджетное образовательное учреждение высшего образования «Удмуртский государственный университет»|Удмуртская Республика| г. Ижевск|Государственный головной ВУЗ|426034, Удмуртская Республика, г. Ижевск, ул. Университетская, д. 1|2237 от 28.06.2016 (Бессрочная)|['010301', '010302', '010303', '010601', '020301', '020302', '020401', '020402', '020601', '030301', '030302', '030402', '030601', '040301', '040302', '040401', '040402', '040601', '050302', '050303', '050306', '050402', '050406', '050601', '060301', '060401', '060601', '090204', '090301', '090302', '090303', '090601', '100301', '100505', '130301', '130302', '130402', '190301', '200204', '200301', '200302', '200401', '200402', '200601', '210201', '210301', '210401', '210502', '210506', '210601', '370301', '370302', '370401', '370402', '370501', '370601', '380201', '380301', '380302', '380303', '380304', '380305', '380306', '380401', '380402', '380403', '380404', '380406', '380501', '380601', '390301', '390302', '390303', '390401', '390402', '390403', '390601', '400201', '400202', '400301', '400401', '400501', '400502', '400503', '400601', '410304', '410305', '420201', '420301', '420302', '420303', '420403', '420405', '430210', '430302', '430303', '430402', '430403', '440301', '440302', '440303', '440304', '440305', '440401', '440402', '440403', '440404', '440601', '450301', '450302', '450401', '450402', '450601', '460301', '460302', '460401', '460601', '490301', '490601', '500601', '510301', '510302', '510306', '510401', '530304', '530305', '530306', '540201', '540301', '540302', '540303', '540401', '540501']
242|8994|Богучарский филиал Федерального государственного образовательного учреждения среднего профессионального образования Воронежского государственного промышленно-гуманитарного колледжа|Воронежская область| г. Богучар|Государственный филиал|396791, Воронежская область, г. Богучар, ул. Мира, д. 141а|2094 от 02.11.2011 (Бессрочная)|['030503', '080501', '140613', '230101']
