|id|Название|Регион:|Населённый пункт:|Форма собственности:|Адрес:|Лицензия: №|specialization
0|5440|Институт нефти и технологий (филиал) федерального государственного бюджетного образовательного учреждения высшего образования «Югорский государственный университет»|Ханты-Мансийский автономный округ - Югра|г. Сургут|Негосударственный филиал|628415, Ханты-Мансийский автономный округ-Югра, г. Сургут, ул. Григория Кукуевицкого, д.3|1868 от 30.12.2015 (Бессрочная)|['150201', '150201', '150212', '180209', '180209', '180212', '210201', '210201', '210202', '210202', '230203', '230203', '230207', '380201', '380201']
1|1002|федеральное государственное казенное образовательное учреждение высшего образования «Белгородский юридический институт Министерства внутренних дел Российской Федерации имени И.Д. Путилина»|Белгородская область|г. Белгород|Государственный головной ВУЗ|Российская Федерация, 308024, Белгородская область, г. Белгород, ул. Горького, д. 71|1579 от 04.08.2015 (Бессрочная)|['400202', '400301', '400501', '400502', '400701', '440701']
2|2793|федеральное государственное бюджетное образовательное учреждение высшего образования «Тюменский индустриальный университет»|Тюменская область|г. Тюмень|Государственный головной ВУЗ|625000, г. Тюмень, ул. Володарского, д. 38|2134 от 13.05.2016 (Бессрочная)|['010302', '010304', '010601', '050301', '050601', '070301', '070303', '080201', '080208', '080301', '080401', '080501', '080502', '080601', '090201', '090202', '090203', '090204', '090205', '090301', '090302', '090304', '090401', '090402', '090404', '090601', '110108', '110202', '110206', '110209', '110210', '110211', '110212', '120301', '120304', '130110', '130202', '130211', '130301', '130302', '130401', '130402', '130601', '150120', '150121', '150125', '150201', '150207', '150208', '150301', '150302', '150303', '150304', '150305', '150306', '150401', '150402', '150403', '150404', '150406', '150501', '150601', '180127', '180209', '180301', '180302', '180401', '180402', '190207', '190210', '190302', '190303', '190304', '190401', '190404', '200201', '200204', '200301', '200401', '200601', '210101', '210102', '210103', '210104', '210201', '210202', '210203', '210205', '210210', '210211', '210301', '210302', '210401', '210402', '210501', '210502', '210503', '210601', '220206', '220301', '220401', '220601', '230203', '230205', '230301', '230302', '230303', '230401', '230402', '230403', '230501', '230601', '270201', '270202', '270301', '270302', '270304', '270305', '270404', '290203', '290204', '290205', '290206', '290302', '370302', '380201', '380202', '380204', '380205', '380207', '380301', '380302', '380303', '380304', '380305', '380306', '380307', '380401', '380402', '380403', '380404', '380405', '380406', '380408', '380409', '380601', '390301', '390302', '390303', '390401', '390402', '390601', '420201', '420202', '420301', '420401', '430201', '430202', '430203', '430204', '430210', '430211', '430301', '430303', '430402', '430403', '440601', '460201', '470601', '540201', '540203', '540301']
3|193|федеральное государственное бюджетное образовательное учреждение высшего образования «Тихоокеанский государственный медицинский университет» Министерства здравоохранения Российской Федерации|Приморский край|г. Владивосток|Негосударственный головной ВУЗ|690000, Приморский край, город Владивосток, Проспект Острякова, дом 2|2333 от 11.08.2016 (Бессрочная)|['300501', '300601', '310203', '310205', '310206', '310501', '310502', '310503', '310601', '310801', '310802', '310805', '310807', '310809', '310810', '310811', '310816', '310818', '310819', '310820', '310821', '310826', '310832', '310835', '310836', '310837', '310839', '310840', '310842', '310849', '310851', '310853', '310854', '310857', '310858', '310859', '310860', '310863', '310866', '310867', '310868', '310869', '310870', '310871', '310874', '310875', '310876', '310877', '320201', '320401', '320501', '320601', '320807', '320810', '320812', '320814', '330201', '330501', '330802', '340201', '340301', '370501', '370601', '390302']
4|9329|Федеральное государственное бюджетное учреждение науки Институт восточных рукописей Российской академии наук|г. Санкт-Петербург|г. Санкт-Петербург|Негосударственный головной ВУЗ|Российская Федерация, 191186, Санкт-Петербург, Дворцовая набережная, 18|0084 от 29.05.2012 (Бессрочная)|['450601', '460601']
5|2604|частное образовательное учреждение высшего образования «Казанский инновационный университет имени В.Г. Тимирясова (ИЭУП)»|Республика Татарстан (Татарстан)|г. Казань|Негосударственный головной ВУЗ|420111, Республика Татарстан, г. Казань, ул. Московская, д. 42|2684 от 07.12.2017 (Бессрочная)|['090205', '090205', '090303', '090303', '100301', '190210', '190210', '190304', '190304', '190404', '200201', '200301', '200301', '230203', '230203', '270302', '270302', '270402', '270402', '370301', '370301', '370401', '370401', '370601', '370601', '380201', '380201', '380203', '380203', '380204', '380204', '380301', '380301', '380302', '380302', '380304', '380304', '380305', '380306', '380401', '380401', '380402', '380402', '380601', '380601', '400201', '400201', '400301', '400301', '400401', '400401', '400601', '400601', '420301', '430210', '430210', '430211', '430211', '430301', '430302', '430302', '430303', '440201', '440201', '440301', '440301', '440302', '440302', '440303', '440303', '440401', '440401', '440402', '440402', '440601', '440601', '450302', '450302', '470601', '470601', '540201', '540201', '540301', '540301']
6|1700|Бурятский институт инфокоммуникаций (филиал) федерального государственного бюджетного образовательного учреждения высшего образования «Сибирский государственный университет телекоммуникаций и информатики» в г. Улан-Удэ|Республика Бурятия|г. Улан-Удэ|Негосударственный филиал|670031, Республика Бурятия, город Улан-Удэ, улица Трубачеева, дом 152|1753 от 09.11.2015 (Бессрочная)|['090203', '090301', '110209', '110211', '110212', '110302', '380201']
7|10767|Федеральное государственное бюджетное учреждение науки Вычислительный центр им. А.А. Дородницына Российской академии наук|г. Москва|г. Москва|Государственный головной ВУЗ|ул.Вавилова 40,г. Москва, 199333|2783 от 17.04.2012 (Бессрочная)|['010109', '051311', '051317', '051318']
8|7085|Филиал образовательного учреждения высшего образования «Санкт-Петербургский институт внешнеэкономических связей, экономики и права» в г. Удомле Тверской области|Тверская область||Негосударственный филиал||1085 от 15.09.2014 (Бессрочная)|['021100', '030501', '030501']
9|1898|Казанский филиал РМАТ|Республика Татарстан (Татарстан)|г. Казань|Негосударственный филиал|420111, Республика Татарстан, г. Казань, ул. Профсоюзная, д. 17|1935 от 15.02.2016 (Бессрочная)|['380302', '430302']
10|1572|филиал федерального государственного бюджетного образовательного учреждения высшего образования «Уфимский государственный авиационный технический университет» в г. Нефтекамске|Республика Башкортостан|г. Нефтекамск|Негосударственный филиал|452683, Республика Башкортостан, г. Нефтекамск, ул. Социалистическая, д. 42|2260 от 08.07.2016 (Бессрочная)|['130301', '130302', '140205', '150301', '150306', '150202', '150301', '150306']
11|77|Автономная некоммерческая организация высшего образования «ВОСТОЧНО-ЕВРОПЕЙСКИЙ ИНСТИТУТ ЭКОНОМИКИ, УПРАВЛЕНИЯ И ПРАВА»|Тульская область|г. Тула|Негосударственный головной ВУЗ|Россия, 300012, г. Тула, ул. Оружейная, д. 5а|1794 от 03.12.2015 (Бессрочная)|['380301', '380302']
12|190|федеральное государственное бюджетное образовательное учреждение высшего образования «Смоленский государственный медицинский университет» Министерства здравоохранения Российской Федерации|Смоленская область|г. Смоленск|Государственный головной ВУЗ|214019, Смоленская область, г. Смоленск, ул. Крупской, д. 28|2384 от 14.09.2016 (Бессрочная)|['300501', '300601', '310501', '310502', '310503', '310601', '310801', '310802', '310807', '310809', '310810', '310811', '310816', '310818', '310819', '310820', '310821', '310826', '310832', '310835', '310836', '310837', '310839', '310842', '310849', '310851', '310853', '310854', '310856', '310857', '310858', '310859', '310863', '310866', '310867', '310868', '310869', '310872', '310873', '310874', '310875', '310876', '310877', '320601', '330501', '330601', '340301', '370501']
13|2079|федеральное государственное автономное образовательное учреждение высшего образования «Сибирский федеральный университет»|Красноярский край|г. Красноярск|Государственный головной ВУЗ|660041, г. Красноярск, проспект Свободный, д. 79|2251 от 04.07.2016 (Бессрочная)|['010301', '010302', '010304', '010401', '010402', '010601', '020301', '020401', '020601', '030302', '030402', '030601', '040301', '040401', '040501', '040601', '050302', '050306', '050406', '050601', '060301', '060401', '060601', '070301', '070303', '070304', '070401', '070402', '070404', '070601', '080301', '080401', '080501', '080601', '090301', '090302', '090303', '090304', '090401', '090402', '090403', '090404', '090501', '090601', '100301', '100501', '100503', '110301', '110302', '110303', '110304', '110401', '110402', '110403', '110404', '110501', '110502', '110601', '120301', '120601', '130301', '130302', '130401', '130402', '130601', '140302', '140401', '150301', '150302', '150303', '150304', '150305', '150306', '150401', '150402', '150405', '150406', '150601', '160301', '160401', '180301', '190210', '190304', '190404', '200301', '200302', '200401', '200501', '210301', '210502', '210503', '210504', '210601', '220301', '220302', '220401', '220402', '220601', '230301', '230302', '230303', '230401', '230402', '230403', '230501', '230502', '230601', '250503', '270301', '270302', '270303', '270304', '270305', '270401', '270402', '270403', '270404', '270405', '270601', '280301', '290304', '370301', '370401', '370601', '380201', '380204', '380301', '380302', '380303', '380304', '380305', '380306', '380307', '380401', '380402', '380403', '380404', '380408', '380501', '380502', '380601', '390301', '390302', '390601', '400301', '400401', '400601', '410305', '420301', '420302', '420402', '430201', '430302', '430303', '440301', '440302', '440304', '440401', '440402', '440601', '450301', '450302', '450401', '450402', '450501', '450601', '460301', '460302', '460401', '460601', '470301', '470303', '470601', '490301', '490303', '490401', '490601', '500301', '500403', '500601', '510301', '510303', '510601', '540301', '540302']
14|2657|федеральное государственное бюджетное образовательное учреждение высшего образования «Московский государственный институт культуры»|Московская область|г. Химки|Государственный головной ВУЗ|141406, Московская область, г. Химки, улица Библиотечная, д. 7|1201 от 24.12.2014 (Бессрочная)|['380301', '380502', '420301', '420302', '420402', '420601', '430302', '430402', '440302', '440601', '450601', '460302', '470601', '500303', '510301', '510302', '510303', '510304', '510305', '510306', '510402', '510403', '510404', '510406', '510501', '510601', '520301', '520306', '520401', '520403', '520501', '520502', '520504', '520904', '520905', '520907', '530203', '530301', '530302', '530303', '530304', '530305', '530306', '530401', '530402', '530403', '530404', '530406', '530504', '540301', '540302', '540401', '550501', '550504', '550901']
15|593|Новочеркасский инженерно-мелиоративный институт имени А.К. Кортунова - филиал федерального государственного бюджетного образовательного учреждения высшего образования «Донской государственный аграрный университет»|Ростовская область| г. Новочеркасск|Негосударственный филиал|346428, Ростовская область, г. Новочеркасск, ул. Пушкинская, 111|1751 от 10.11.2015 (Бессрочная)|['050306', '050306', '050306', '050406', '050601', '080301', '080301', '080301', '080401', '080401', '080401', '080501', '080501', '080502', '080502', '080601', '200203', '200203', '200301', '200301', '200301', '200302', '200302', '200302', '200402', '200402', '200501', '200501', '210204', '210204', '210205', '210205', '210301', '210301', '210301', '210302', '210302', '210302', '210402', '210402', '210402', '230204', '230204', '230301', '230301', '230302', '230302', '230302', '230303', '230303', '230303', '230402', '230402', '230501', '230501', '230501', '350201', '350301', '350301', '350301', '350308', '350308', '350310', '350310', '350310', '350311', '350401', '350401', '350401', '350409', '350409', '350409', '350410', '350601', '350602', '350604', '380301', '380301', '380302', '380302', '380305', '380401', '380401', '380402', '390302', '440301', '440301', '440301', '440304', '440304']
16|6119|Тюменский кардиологический научный центр - филиал Федерального государственного бюджетного научного учреждения «Томский национальный исследовательский медицинский центр Российской академии наук»|Томская область| г. Тюмень|Государственный филиал|625026, г. Тюмень, ул. Мельникайте, 111|2291 от 28.07.2016 (Бессрочная)|['310836']
17|9287|филиал федерального государственного бюджетного образовательного учреждения высшего образования «Санкт-Петербургский государственный экономический университет» в г. Апатиты|Мурманская область||Государственный филиал||1083 от 05.09.2014 (Бессрочная)|['080200', '080502', '230700']
18|10954|федеральное государственное казенное учреждение дополнительного профессионального образования «Всероссийский институт повышения квалификации сотрудников Министерства внутренних дел Российской Федерации»|Московская область| г. Домодедово|Негосударственный головной ВУЗ|Российская Федерация, 142008, Московская обл., г. Домодедово, микрорайон Авиационный, ул. Пихтовая, д. 3|1527 от 30.06.2015 (Бессрочная)|['400701']
19|10663|Сосновоборский филиал федерального государственного бюджетного образовательного учреждения высшего профессионального образования «Санкт-Петербургский государственный университет сервиса и экономики»|Ленинградская область| г. Сосновый Бор|Государственный филиал|ул. Комсомольская, д. 2А, г. Сосновый Бор, Ленинградская область, 188540|2862 от 28.05.2012 (Бессрочная)|['080114', '080500', '080502', '080504', '080507']
20|477|Негосударственное образовательное учреждение высшего профессионального образования «РОСТОВСКИЙ ИНСТИТУТ ИНОСТРАННЫХ ЯЗЫКОВ»|Ростовская область| г. Ростов-на-Дону|Негосударственный головной ВУЗ|ул. 1-я Пролетарская, д. 95/54, г. Ростов-на-Дону, Ростовская область, 344019|2089 от 02.11.2011 (Бессрочная)|['100200']
21|8915|федеральное государственное образовательное бюджетное учреждение среднего профессионального образования «Ростовский-на-Дону государственный колледж связи и информатики»|Ростовская область| г. Ростов-на-Дону|Государственный головной ВУЗ|ул. Тургеневская, д. 10/6, г. Ростов-на-Дону, Ростовская область, 344082|1873 от 26.09.2011 (Бессрочная)|['080108', '080110', '080501', '090108', '210404', '210406', '210406', '210407', '210501', '230105', '230105', '230106']
22|9190|Федеральное государственное бюджетное учреждение науки Институт леса Карельского научного центра Российской академии наук|Республика Карелия|г. Петрозаводск|Негосударственный головной ВУЗ|185910, Российская Федерация, Республика Карелия, г. Петрозаводск, ул. Пушкинская, д. 11|0064 от 29.05.2012 (Бессрочная)|['350602']
23|343|Частное образовательное учреждение высшего образования «Байкальский экономико-правовой институт»|Республика Бурятия|г. Улан-Удэ|Негосударственный головной ВУЗ|670047, Россия, Республика Бурятия, г. Улан-Удэ, ул. Сахьяновой, дом 9|2662 от 12.10.2017 (Бессрочная)|['030300', '030301', '030500', '030501', '080100', '080105', '080109', '080500', '080507']
24|8803|Марийский филиал Автономной некоммерческой организации высшего профессионального образования «Московская открытая социальная академия»|Республика Марий Эл| г. Йошкар-Ола|Негосударственный филиал|424003, Республика Марий Эл, г. Йошкар-Ола, Ленинский просп., д. 56а|0820 от 03.03.2011 (Бессрочная)|['030300', '030301', '030500', '030501', '080100', '080109', '080500', '080507', '090102']
25|531|Негосударственное образовательное частное учреждение высшего профессионального образования «Институт русского театра»|г. Москва|г. Москва|Негосударственный головной ВУЗ|Россия, 125252, г. Москва, ул. Зорге, д. 24, корпус Б|1312 от 11.03.2015 (Бессрочная)|['030602', '070201', '070204', '070304', '070601', '071200', '080507']
26|7043|Федеральное государственное образовательное учреждение среднего профессионального образования «Московский издательско-полиграфический колледж имени Ивана Федорова»|г. Москва| г. Москва|Государственный головной ВУЗ|Ярославское шоссе, д. 5, г. Москва, г. Москва, 129337|1315 от 24.05.2011 (Бессрочная)|['030902', '030902', '032401', '070602', '080110', '150411', '260910', '261203', '261203']
27|5661|Лиховской техникум железнодорожного транспорта - филиал федерального государственного бюджетного образовательного учреждения высшего образования «Ростовский государственный университет путей сообщения»|Ростовская область|г. Каменск-Шахтинск|Негосударственный филиал|347820, Ростовская область, г. Каменск-Шахтинский, мкр. Лиховской, пер. Строителей, д. 27а|2118 от 26.04.2016 (Бессрочная)|['230201', '230206', '270203']
28|9202|Федеральное государственное бюджетное учреждение науки Институт механики сплошных сред Уральского отделения Российской академии наук|Пермский край|г. Пермь|Негосударственный головной ВУЗ|Российская Федерация, 614013, г. Пермь, ул. Академика Королева, 1|0165 от 17.07.2012 (Бессрочная)|['010601']
29|2244|Филиал «Угреша» государственного бюджетного образовательного учреждения высшего образования Московской области «Университет «Дубна»|Московская область|г. Дзержинский|Негосударственный филиал|140090, Московская область, г. Дзержинский, ул. Академика Жукова, д. 24|2068 от 08.04.2016 (Бессрочная)|['050306', '090302', '220301']
30|2509|Таймырский филиал государственного автономного образовательного учреждения высшего образования Ленинградской области «Ленинградский государственный университет имени А.С. Пушкина»|Красноярский край|г. Дудинка|Государственный филиал|647000, Красноярский край, Таймырский (Долгано-Ненецкий) Автономный округ, г. Дудинка, ул. Щорса, д. 1|2387 от 15.09.2016 (Бессрочная)|['030501', '080504', '080507']
