|id|Название|Регион:|Населённый пункт:|Форма собственности:|Адрес:|Лицензия: №|specialization
105|11015|федеральное государственное бюджетное образовательное учреждение среднего профессионального образования «Алексеевский колледж экономики и информационных технологий»|Белгородская область| г. Алексеевка|Государственный головной ВУЗ|ул. Ленина, д. 22, г. Алексеевка, Белгородская область, 309850|2065 от 28.10.2011 (Бессрочная)|['030503', '030503', '080107', '080110', '080110', '080114', '080501', '120301', '230103']
106|2057|Частное образовательное учреждение высшего образования «Брянский институт управления и бизнеса»|Брянская область|г. Брянск|Негосударственный головной ВУЗ|Российская Федерация, 241050, г. Брянск, ул. 2-я Почепская, д. 42|0986 от 25.04.2014 (Бессрочная)|['030500', '030501', '030503', '080100', '080105', '080106', '080109', '080112', '080114', '080500', '080500', '080501', '080502', '080507', '080801', '230105', '230700']
107|1945|Альметьевский филиал федерального государственного бюджетного образовательного учреждения высшего образования «Казанский национальный исследовательский технический университет им. А.Н. Туполева-КАИ»|Республика Татарстан (Татарстан)|г. Альметьевск|Негосударственный филиал|423457, Республика Татарстан, г. Альметьевск, пр-кт Строителей, д. 9 «б»|2096 от 20.04.2016 (Бессрочная)|['090301', '090303', '150305', '200301', '380301']
108|11191|ФЕДЕРАЛЬНОЕ ГОСУДАРСТВЕННОЕ БЮДЖЕТНОЕ УЧРЕЖДЕНИЕ «НАУЧНО-ИССЛЕДОВАТЕЛЬСКИЙ ИНСТИТУТ ГРИППА ИМЕНИ А.А. СМОРОДИНЦЕВА» МИНИСТЕРСТВА ЗДРАВООХРАНЕНИЯ РОССИЙСКОЙ ФЕДЕРАЦИИ|г. Санкт-Петербург|г. Санкт-Петербург|Государственный головной ВУЗ|197376, Российская Федерация, г. Санкт - Петербург, ул. Профессора Попова, д. 15/17|2763 от 24.07.2018 (Бессрочная)|['300601', '310601', '310835']
109|2803|филиал федерального государственного бюджетного образовательного учреждения высшего образования «Тюменский индустриальный университет» в городе Ялуторовске|Тюменская область|г. Ялуторовск|Негосударственный филиал|627010 ,Тюменская область, г. Ялуторовск, ул. Бахтиярова, д. 60/1|2134 от 13.05.2016 (Бессрочная)|['090203', '090204', '150105', '150120', '150126', '190104', '190117', '190207', '190210', '230103', '230203', '230302', '230303', '290107', '290108', '380102', '400201']
110|2055|федеральное государственное бюджетное образовательное учреждение высшего образования «Югорский государственный университет»|Ханты-Мансийский автономный округ - Югра|г. Ханты-Мансийск|Государственный головной ВУЗ|628012, Ханты-Мансийский автономный округ-Югра, г. Ханты-Мансийск, ул. Чехова, д. 16|1868 от 30.12.2015 (Бессрочная)|['010402', '010601', '040301', '040401', '040501', '040601', '050306', '050406', '050601', '060401', '080301', '080601', '090301', '090304', '090601', '130302', '130402', '130601', '200301', '200401', '210301', '210502', '220301', '230303', '380301', '380302', '380303', '380304', '380401', '380404', '380408', '380501', '380601', '390302', '400301', '400401', '400601', '420302', '420402', '430302', '430303', '440302', '440402', '440601', '450301', '450302', '450401', '450601', '460401', '490301', '490401', '490403', '490601']
111|313|Частное образовательное учреждение высшего образования «Уральский гуманитарный институт»|Свердловская область|г. Екатеринбург|Негосударственный головной ВУЗ|620078, Свердловская область, г. Екатеринбург, ул. Комсомольская, д. 63|1457 от 29.05.2015 (Бессрочная)|['030301', '030501', '030900', '031202', '080100', '080105', '080200', '080507', '080801']
112|721|федеральное государственное автономное образовательное учреждение высшего образования «Национальный исследовательский университет ИТМО»|г. Санкт-Петербург| г. Санкт-Петербург|Государственный головной ВУЗ|Российская Федерация, 197101, г. Санкт-Петербург, Кронверкский проспект, д. 49|2923 от 09.09.2020 (Бессрочная)|['010302', '010304', '010402', '010601', '020401', '020403', '030601', '040601', '050601', '060601', '070404', '090207', '090301', '090302', '090303', '090304', '090401', '090402', '090403', '090404', '090601', '100301', '100401', '100601', '110302', '110303', '110402', '110403', '110601', '120301', '120302', '120303', '120304', '120305', '120401', '120402', '120403', '120404', '120405', '120501', '120601', '130301', '130302', '130402', '130601', '140301', '150302', '150304', '150306', '150402', '150404', '150406', '150601', '160301', '160303', '160401', '160403', '180301', '180302', '180401', '180402', '180601', '190301', '190302', '190303', '190401', '190402', '190403', '190601', '200401', '220601', '230303', '230403', '240302', '240401', '240402', '270304', '270305', '270401', '270402', '270403', '270404', '270405', '270407', '270408', '270601', '380301', '380302', '380305', '380401', '380402', '380405', '380502', '380601', '410601', '440304', '450304', '450404', '470601']
113|1736|Филиал федерального государственного казенного военного образовательного учреждения высшего образования «Военная академия материально-технического обеспечения имени генерала армии А.В.Хрулева» Министерства обороны Российской Федерации в г. Вольске|Саратовская область|г. Вольск|Негосударственный филиал|ул. М. Горького, д. 3, г. Вольск, Саратовская область, Россия, 412903|1824 от 16.12.2015 (Бессрочная)|['080225', '380203', '380203', '380203', '560501', '560501', '560701', '560701']
114|9643|Калужский филиал федерального государственного бюджетного образовательного учреждения высшего профессионального образования «Московский государственный университет, экономики, статистики и информатики»|Калужская область| г. Калуга|Государственный филиал|ул. Дзержинского, д. 25а, г. Калуга, Калужская область, 248001|1913 от 29.09.2011 (Бессрочная)|['080110', '080110', '080601', '080601', '230103', '230103']
115|2652|федеральное государственное бюджетное образовательное учреждение высшего образования «Челябинский государственный университет»|Челябинская область|г. г.Челябинск|Негосударственный головной ВУЗ|454001, г. Челябинск, ул. Бр. Кашириных, 129|2283 от 21.07.2016 (Бессрочная)|['010301', '010302', '010302', '010401', '010401', '010402', '010402', '010501', '010601', '020301', '020301', '020302', '020302', '020402', '020402', '030302', '030302', '030303', '030303', '030402', '030402', '030403', '030403', '030601', '040301', '040301', '040401', '040401', '040501', '040501', '040601', '050306', '050306', '050406', '050406', '060301', '060301', '060401', '060401', '060601', '090204', '090204', '090301', '090301', '090302', '090303', '090303', '090304', '090304', '090401', '090601', '100301', '100501', '100501', '100503', '100503', '100504', '200601', '220301', '220301', '230203', '270302', '270302', '270303', '270305', '280302', '280302', '300501', '300502', '300601', '350201', '350201', '350301', '350301', '350308', '350308', '370301', '370301', '370401', '370401', '370501', '370501', '370502', '370601', '380201', '380301', '380302', '380303', '380304', '380305', '380401', '380402', '380403', '380404', '380405', '380408', '380501', '380502', '380601', '390301', '390301', '390302', '390302', '390401', '400201', '400201', '400202', '400202', '400301', '400301', '400401', '400401', '400501', '400501', '400502', '400502', '400504', '400601', '410301', '410301', '410302', '410304', '410304', '410305', '410305', '410306', '410404', '410404', '410405', '410601', '420301', '420301', '420302', '420302', '420305', '420402', '420402', '420601', '430211', '430211', '440206', '440301', '440302', '440302', '440303', '440303', '440305', '440305', '440401', '440401', '440402', '440402', '440403', '440403', '440404', '440501', '440601', '450301', '450301', '450302', '450302', '450401', '450401', '450402', '450402', '450501', '450501', '450601', '460301', '460301', '460302', '460401', '460401', '460601', '470301', '470301', '470303', '470303', '470401', '470403', '470601', '490303', '500301', '500303']
116|949|федеральное государственное бюджетное образовательное учреждение высшего образования «Чеченский государственный университет имени Ахмата Абдулхамидовича Кадырова»|Чеченская Республика|г. Грозный|Государственный головной ВУЗ|Россия, 364907, Чеченская Республика, г. Грозный, ул. А.Шерипова, дом №32|2974 от 23.07.2021 (Бессрочная)|['010301', '010302', '010401', '010601', '030302', '030303', '030402', '030403', '030601', '040301', '040401', '040601', '050302', '050303', '050304', '050306', '050402', '050406', '050601', '060301', '060401', '060601', '090103', '090205', '090207', '090304', '090401', '110302', '180102', '190102', '300501', '300502', '300601', '310201', '310202', '310501', '310502', '310503', '310801', '310816', '310818', '310819', '310820', '310821', '310832', '310835', '310837', '310842', '310849', '310857', '310867', '310872', '310874', '350304', '350305', '350307', '350404', '350601', '360301', '360302', '360402', '360501', '380201', '380202', '380203', '380205', '380206', '380207', '380301', '380302', '380303', '380304', '380305', '380306', '380401', '380402', '380404', '380405', '380406', '380408', '380601', '390201', '390302', '390402', '400201', '400203', '400301', '400401', '400601', '410301', '420302', '420402', '430301', '430302', '430402', '440201', '440205', '440302', '440402', '440601', '450301', '450302', '450401', '450402', '450601', '460301', '460401', '460601', '470601', '510301', '510304', '520501']
117|5476|Самарский финансово-экономический колледж - филиал федерального государственного образовательного бюджетного учреждения высшего образования «Финансовый университет при Правительстве Российской Федерации»|Самарская область|г. Самара|Негосударственный филиал|443099, г. Самара, ул. Куйбышева, 91|1495 от 09.06.2015 (Бессрочная)|['380201', '380201', '380201', '380201', '380201', '380202', '380206', '380206', '380206', '380206', '380207', '380207', '380207', '380207']
118|2722|Автономная некоммерческая организация высшего образования «Кубанский институт международного предпринимательства и менеджмента»|Краснодарский край| г. Краснодар|Негосударственный головной ВУЗ|350063, Краснодарский край, г. Краснодар, ул. Кубанская Набережная, д. 3|1316 от 11.03.2015 (Бессрочная)|['080100', '080102', '080105', '080109', '080500', '080504', '080507']
119|615|Пермский институт (филиал) федерального государственного бюджетного образовательного учреждения высшего образования «Российский экономический университет имени Г.В. Плеханова»|Пермский край| г. Пермь|Негосударственный филиал|614070, г. Пермь, б-р Гагарина, д. 57|1789 от 30.11.2015 (Бессрочная)|['090203', '090203', '090204', '090204', '090303', '090303', '190210', '190210', '190304', '190304', '380201', '380201', '380202', '380202', '380205', '380205', '380207', '380207', '380301', '380301', '380302', '380302', '380306', '380306', '380307', '380307', '380401', '380401', '380402', '380402', '380406', '380406']
120|5996|"Автономная некоммерческая организация высшего образования Самарский университет государственного управления ""Международный институт рынка"""|Самарская область||Негосударственный головной ВУЗ||2602 от 19.06.2017 (Бессрочная)|['090303', '210205', '210302', '380207', '380301', '380302', '380303', '380304', '380305', '380401', '380402', '380403', '380404', '380408', '400201']
121|10338|Федеральное государственное бюджетное учреждение науки Институт ядерной физики им. Г.И. Будкера Сибирского отделения Российской академии наук|Новосибирская область| г. Новосибирск|Негосударственный головной ВУЗ|630090, г. Новосибирск, проспект Академика Лаврентьева, д. 11|2592 от 19.03.2012 (Бессрочная)|['030601']
122|7700|Ванинский филиал Федерального государственного образовательного учреждения среднего профессионального образования Хабаровского промышленно-экономического техникума|Хабаровский край||Государственный филиал|682860, Хабаровский край, пос. Ванино, ул. Киевская, д. 2|2158 от 14.11.2011 (Бессрочная)|['030503', '080110', '080302', '190605', '230103', '250403']
123|1040|филиал Автономной некоммерческой организации высшего образования «Институт экономики и антикризисного управления» в г. Вольске|Саратовская область|г. Вольск|Негосударственный филиал|412909, Саратовская область, г. Вольск, ул. Красногвардейская, д. 30|1821 от 10.12.2015 (Бессрочная)|['380301', '380302']
124|5175|Автономная некоммерческая образовательная организация высшего образования «Уральский Финансово-Юридический институт»|Свердловская область| г. Екатеринбург|Негосударственный головной ВУЗ|Российская Федерация, 620075, г. Екатеринбург, ул. Карла Либкнехта, д. 1|1274 от 09.02.2015 (Бессрочная)|['030501', '030900', '030900', '080005', '080100', '080100', '080105', '120001']
125|2650|Миасский филиал федерального государственного бюджетного образовательного учреждения высшего образования «Челябинский государственный университет»|Челябинская область|г. Миасс|Негосударственный филиал|456313, Челябинская область, г. Миасс, ул. Керченская, д. 1|2283 от 21.07.2016 (Бессрочная)|['010302', '010302', '010402', '020302', '020302', '380301', '380302', '380304', '380304', '380501', '380501', '450301', '450301', '450302', '450401', '450401']
126|1102|Частное образовательное учреждение высшего образования «Санкт-Петербургский институт экономики и управления»|г. Санкт-Петербург|г. Санкт-Петербург|Негосударственный головной ВУЗ|Кондратьевский пр., дом 40, корп. 14, лит. А, г. Санкт-Петербург, 195197|1503 от 19.06.2015 (Бессрочная)|['380201', '380206']
127|1130|Филиал Автономной некоммерческой организации Высшего Образования «Институт деловой карьеры» в Смоленской области|Смоленская область|г. Смоленск|Негосударственный филиал|214012, Смоленская область, г. Смоленск, ул. Ново-Московская, д. 2/8|2869 от 11.11.2019 (Бессрочная)|['021100', '030501', '030501']
128|2004|филиал частного образовательного учреждения высшего образования Современная гуманитарная академия в городе Комсомольске-на-Амуре|Хабаровский край|г. Комсомольск-на-Амуре|Негосударственный филиал|681013, Хабаровский край, г. Комсомольск-на-Амуре, пр. Ленина, д. 34, кор. 3|2370 от 06.09.2016 (Бессрочная)|['030500']
129|2248|Воркутинский филиал Ухтинского государственного технического университета|Республика Коми|г. Воркута|Негосударственный филиал|169900, Республика Коми, г. Воркута, ул. Ленина, д. 44|2254 от 08.07.2016 (Бессрочная)|['080301', '200301', '210301', '210504', '380302']
130|1958|Негосударственное образовательное частное учреждение высшего профессионального образования «Академический правовой институт»|г. Москва|г. Москва|Негосударственный головной ВУЗ|119019, г. Москва, ул. Знаменка, д. 10|0819 от 01.08.2013 (Бессрочная)|['030501']
131|150|государственное бюджетное образовательное учреждение высшего образования Калининградской области «Педагогический институт»|Калининградская область|г. Черняховск|Негосударственный головной ВУЗ|238151, Россия, Калининградская обл., Черняховский р-н, г. Черняховск, пер. Суворова, дом № 2|1029 от 19.06.2014 (Бессрочная)|['050100', '050100', '440201', '440202', '490201']
132|1622|Алтайский филиал федерального государственного образовательного бюджетного учреждения высшего образования «Финансовый университет при Правительстве Российской Федерации»|Алтайский край| г. Барнаул|Негосударственный филиал|656038, Алтайский край, г. Барнаул, просп. Ленина, д. 54|1495 от 09.06.2015 (Бессрочная)|['080100', '080100', '080105', '080109', '080200', '080500', '080507', '380301', '380301', '380301', '380302', '380302', '380302', '380305', '380305', '380401', '380401', '380401', '380402', '380402', '380402']
133|2802|филиал федерального государственного бюджетного образовательного учреждения высшего образования «Тюменский индустриальный университет» в городе Муравленко|Ямало-Ненецкий автономный округ|г. Муравленко|Негосударственный филиал|629603, Тюменская область, Ямало-Ненецкий автономный округ, г. Муравленко, ул. Нефтяников, д. 67|2134 от 13.05.2016 (Бессрочная)|['130503', '190603']
134|9975|федеральное государственное образовательное учреждение среднего профессионального образования «Сердобский сельскохозяйственный техникум»|Пензенская область| г. Сердобск|Государственный головной ВУЗ|ул. Куйбышева, д. 58, г. Сердобск, Пензенская область, 442895|1069 от 31.03.2011 (Бессрочная)|['030503', '080110', '080302', '110401', '111201']
135|6714|Федеральное государственное бюджетное учреждение науки Институт теоретической и прикладной электродинамики Российской академии наук|г. Москва|г. Москва|Негосударственный головной ВУЗ|125412, г. Москва, ул. Ижорская, д. 13|2549 от 13.03.2012 (Бессрочная)|['030601']
136|1859|федеральное государственное автономное образовательное учреждение высшего образования «Российский университет транспорта»|г. Москва|г. Москва|Государственный головной ВУЗ|127994, г. Москва, ул. Образцова, д. 9, стр. 9|2820 от 16.04.2019 (Бессрочная)|['010302', '010601', '050601', '080210', '080301', '080401', '080501', '080601', '090202', '090204', '090301', '090302', '090303', '090401', '090403', '090601', '100301', '100501', '110206', '110302', '110601', '130207', '130301', '130302', '130401', '130402', '130601', '150301', '150302', '150305', '150306', '150401', '150402', '150404', '150405', '150406', '150601', '200301', '200401', '200601', '210205', '210302', '230201', '230203', '230204', '230206', '230301', '230302', '230303', '230401', '230402', '230501', '230503', '230504', '230505', '230506', '230601', '260203', '260301', '260507', '270203', '270301', '270302', '270304', '270305', '270401', '270402', '270404', '270405', '270406', '310201', '310205', '340201', '370301', '380201', '380202', '380203', '380301', '380302', '380303', '380304', '380305', '380306', '380401', '380402', '380403', '380404', '380405', '380406', '380408', '380501', '380502', '380601', '390301', '390601', '400201', '400203', '400301', '400401', '400501', '400502', '400503', '400601', '410304', '410305', '410405', '410601', '420301', '420302', '420401', '430301', '430302', '430303', '450302', '460302', '460601', '470601']
